{
  "result_id": "EXP-005-1.0.1-20260911T175641Z-U8ZL",
  "experiment_id": "EXP-005",
  "experiment_version": "1.0.1",
  "run_id": "EXP-005-1.0.1-20260911T175641Z-U8ZL",
  "status": "revealed",
  "hypothesis": "Explicit foreground, midground, and background role assignment improves spatial depth coherence compared with a generic cinematic-depth instruction",
  "primary_dimension": "spatial_depth_coherence",
  "generation": {
    "mode": "host_native",
    "model": "gpt-image-2",
    "model_snapshot": "unknown",
    "replicates_per_variant": 4
  },
  "review": {
    "protocol": "second_layer_blind_review_with_precommitted_mapping",
    "review_set_count": 1,
    "review_sha256": "e138b158bdf68850c2037bd0e6c61736c1d6a1e5f1ab72d2fdd806cabb4b7e57",
    "mapping_commitment_sha256": "19e9ddde17d414c3f1727115762b0f6e662e8066cc17332ef29ce5544bccbf50",
    "frozen_at_utc": "2026-09-11T19:38:32.123806+00:00",
    "revealed_at_utc": "2026-09-11T19:38:40.820232+00:00"
  },
  "variants": {
    "control": {
      "factor": "generic_cinematic_depth",
      "n": 4,
      "means": {
        "semantic_compliance": 4.75,
        "aesthetic_quality": 4.5,
        "technical_defects": 4.75,
        "spatial_depth_coherence": 4.75,
        "overall": 4.6875
      },
      "overall_sample_sd": 0.375
    },
    "variant": {
      "factor": "explicit_layered_spatial_roles",
      "n": 4,
      "means": {
        "semantic_compliance": 4.75,
        "aesthetic_quality": 4.0,
        "technical_defects": 4.5,
        "spatial_depth_coherence": 5.0,
        "overall": 4.5625
      },
      "overall_sample_sd": 0.2394
    }
  },
  "deltas_variant_minus_control": {
    "semantic_compliance": 0.0,
    "aesthetic_quality": -0.5,
    "technical_defects": -0.25,
    "spatial_depth_coherence": 0.25,
    "overall": -0.125
  },
  "evidence_classification": "weakly_supports",
  "interpretation": "In this refined-interior portrait context, explicit foreground/midground/background role assignment improved the primary spatial_depth_coherence score by 0.25 over generic cinematic-depth language. Semantic compliance was unchanged, while aesthetic quality decreased by 0.50, technical-defect cleanliness decreased by 0.25, and the overall mean decreased by 0.125. All four explicit-layering outputs received the maximum score of 5 on the primary dimension, and the treatment group showed lower across-replicate variability. This single small-N run weakly supports the tested spatial-depth mechanism in this context, but it does not show general overall-quality superiority. Replication across compositions, environments, subjects, focal lengths, and routes is required before stronger generalization.",
  "limitations": [
    "Four replicates per variant are insufficient for a statistical-significance claim.",
    "The review contains one frozen score set, so inter-rater reliability was not measured.",
    "The primary spatial_depth_coherence score was near the 1-5 scale ceiling in both conditions, limiting discrimination.",
    "The host exposed the model family as gpt-image-2 but not an exact model snapshot or reproducible generation seed.",
    "The finding is specific to one refined-interior portrait scenario with a doorway, window, distant furniture, satin outfit, and ceramic vase; replication across other compositions, environments, subjects, focal lengths, and routes is required."
  ],
  "pattern_implications": [
    {
      "pattern_id": "composition-layered-depth",
      "recommended_validation_status": "supported",
      "compiler_eligible": true,
      "reason": "The pattern already had repeated internal-corpus observations, a human-curated project rule, and compiler/regression support. EXP-005 adds controlled blinded empirical evidence in which explicit spatial-role assignment improved the primary spatial_depth_coherence dimension by 0.25, but aesthetic quality decreased by 0.50, technical-defect cleanliness decreased by 0.25, and the overall mean decreased by 0.125. Keep the pattern supported, compiler-eligible, and enabled at the Director Gate for its existing routes, while recording the direct result as weakly supportive and context-specific pending replication."
    }
  ],
  "raw_scores": [
    {
      "review_id": "RLJWM8B6",
      "blind_id": "EW6Y76",
      "variant_id": "control",
      "factor": "generic_cinematic_depth",
      "replicate": 1,
      "scores": {
        "semantic_compliance": 4,
        "aesthetic_quality": 4,
        "technical_defects": 5,
        "spatial_depth_coherence": 4
      },
      "overall": 4.25
    },
    {
      "review_id": "RQ4EUKUB",
      "blind_id": "9DDQHW",
      "variant_id": "control",
      "factor": "generic_cinematic_depth",
      "replicate": 2,
      "scores": {
        "semantic_compliance": 5,
        "aesthetic_quality": 5,
        "technical_defects": 5,
        "spatial_depth_coherence": 5
      },
      "overall": 5.0
    },
    {
      "review_id": "RVKBLEEJ",
      "blind_id": "4DKAZR",
      "variant_id": "control",
      "factor": "generic_cinematic_depth",
      "replicate": 3,
      "scores": {
        "semantic_compliance": 5,
        "aesthetic_quality": 4,
        "technical_defects": 4,
        "spatial_depth_coherence": 5
      },
      "overall": 4.5
    },
    {
      "review_id": "R89WCHVR",
      "blind_id": "63CU4E",
      "variant_id": "control",
      "factor": "generic_cinematic_depth",
      "replicate": 4,
      "scores": {
        "semantic_compliance": 5,
        "aesthetic_quality": 5,
        "technical_defects": 5,
        "spatial_depth_coherence": 5
      },
      "overall": 5.0
    },
    {
      "review_id": "RBPQK7D5",
      "blind_id": "2NB3YP",
      "variant_id": "variant",
      "factor": "explicit_layered_spatial_roles",
      "replicate": 1,
      "scores": {
        "semantic_compliance": 5,
        "aesthetic_quality": 4,
        "technical_defects": 4,
        "spatial_depth_coherence": 5
      },
      "overall": 4.5
    },
    {
      "review_id": "R7B2GHNV",
      "blind_id": "JCQTVJ",
      "variant_id": "variant",
      "factor": "explicit_layered_spatial_roles",
      "replicate": 2,
      "scores": {
        "semantic_compliance": 5,
        "aesthetic_quality": 4,
        "technical_defects": 5,
        "spatial_depth_coherence": 5
      },
      "overall": 4.75
    },
    {
      "review_id": "RDMQF3N3",
      "blind_id": "P6EWT6",
      "variant_id": "variant",
      "factor": "explicit_layered_spatial_roles",
      "replicate": 3,
      "scores": {
        "semantic_compliance": 5,
        "aesthetic_quality": 4,
        "technical_defects": 5,
        "spatial_depth_coherence": 5
      },
      "overall": 4.75
    },
    {
      "review_id": "RTMUQ392",
      "blind_id": "6BUCZL",
      "variant_id": "variant",
      "factor": "explicit_layered_spatial_roles",
      "replicate": 4,
      "scores": {
        "semantic_compliance": 4,
        "aesthetic_quality": 4,
        "technical_defects": 4,
        "spatial_depth_coherence": 5
      },
      "overall": 4.25
    }
  ]
}
